{
  "version": 2,
  "id": "garden",
  "width": 800,
  "height": 480,
  "grid": 32,
  "settings": {
    "camera": {
      "x": 400,
      "y": 240
    },
    "cameraZoom": 1.25,
    "background": "#21362e",
    "weather": "clear",
    "ambient": 0.5
  },
  "layers": [
    {
      "id": "ground",
      "name": "Floor",
      "kind": "tile",
      "visible": true,
      "locked": false,
      "opacity": 1,
      "tiles": [
        {
          "x": 0,
          "y": 0,
          "type": "floor",
          "width": 32,
          "height": 32
        },
        {
          "x": 32,
          "y": 0,
          "type": "floor",
          "width": 32,
          "height": 32
        },
        {
          "x": 64,
          "y": 0,
          "type": "floor",
          "width": 32,
          "height": 32
        },
        {
          "x": 96,
          "y": 0,
          "type": "floor",
          "width": 32,
          "height": 32
        },
        {
          "x": 128,
          "y": 0,
          "type": "floor",
          "width": 32,
          "height": 32
        },
        {
          "x": 160,
          "y": 0,
          "type": "floor",
          "width": 32,
          "height": 32
        },
        {
          "x": 192,
          "y": 0,
          "type": "floor",
          "width": 32,
          "height": 32
        },
        {
          "x": 224,
          "y": 0,
          "type": "floor",
          "width": 32,
          "height": 32
        },
        {
          "x": 256,
          "y": 0,
          "type": "floor",
          "width": 32,
          "height": 32
        },
        {
          "x": 288,
          "y": 0,
          "type": "floor",
          "width": 32,
          "height": 32
        },
        {
          "x": 320,
          "y": 0,
          "type": "floor",
          "width": 32,
          "height": 32
        },
        {
          "x": 352,
          "y": 0,
          "type": "floor",
          "width": 32,
          "height": 32
        },
        {
          "x": 384,
          "y": 0,
          "type": "floor",
          "width": 32,
          "height": 32
        },
        {
          "x": 416,
          "y": 0,
          "type": "floor",
          "width": 32,
          "height": 32
        },
        {
          "x": 448,
          "y": 0,
          "type": "floor",
          "width": 32,
          "height": 32
        },
        {
          "x": 480,
          "y": 0,
          "type": "floor",
          "width": 32,
          "height": 32
        },
        {
          "x": 512,
          "y": 0,
          "type": "floor",
          "width": 32,
          "height": 32
        },
        {
          "x": 544,
          "y": 0,
          "type": "floor",
          "width": 32,
          "height": 32
        },
        {
          "x": 576,
          "y": 0,
          "type": "floor",
          "width": 32,
          "height": 32
        },
        {
          "x": 608,
          "y": 0,
          "type": "floor",
          "width": 32,
          "height": 32
        },
        {
          "x": 640,
          "y": 0,
          "type": "floor",
          "width": 32,
          "height": 32
        },
        {
          "x": 672,
          "y": 0,
          "type": "floor",
          "width": 32,
          "height": 32
        },
        {
          "x": 704,
          "y": 0,
          "type": "floor",
          "width": 32,
          "height": 32
        },
        {
          "x": 736,
          "y": 0,
          "type": "floor",
          "width": 32,
          "height": 32
        },
        {
          "x": 768,
          "y": 0,
          "type": "floor",
          "width": 32,
          "height": 32
        },
        {
          "x": 0,
          "y": 32,
          "type": "floor",
          "width": 32,
          "height": 32
        },
        {
          "x": 32,
          "y": 32,
          "type": "floor",
          "width": 32,
          "height": 32
        },
        {
          "x": 64,
          "y": 32,
          "type": "floor",
          "width": 32,
          "height": 32
        },
        {
          "x": 96,
          "y": 32,
          "type": "floor",
          "width": 32,
          "height": 32
        },
        {
          "x": 128,
          "y": 32,
          "type": "floor",
          "width": 32,
          "height": 32
        },
        {
          "x": 160,
          "y": 32,
          "type": "floor",
          "width": 32,
          "height": 32
        },
        {
          "x": 192,
          "y": 32,
          "type": "floor",
          "width": 32,
          "height": 32
        },
        {
          "x": 224,
          "y": 32,
          "type": "floor",
          "width": 32,
          "height": 32
        },
        {
          "x": 256,
          "y": 32,
          "type": "floor",
          "width": 32,
          "height": 32
        },
        {
          "x": 288,
          "y": 32,
          "type": "floor",
          "width": 32,
          "height": 32
        },
        {
          "x": 320,
          "y": 32,
          "type": "floor",
          "width": 32,
          "height": 32
        },
        {
          "x": 352,
          "y": 32,
          "type": "floor",
          "width": 32,
          "height": 32
        },
        {
          "x": 384,
          "y": 32,
          "type": "floor",
          "width": 32,
          "height": 32
        },
        {
          "x": 416,
          "y": 32,
          "type": "floor",
          "width": 32,
          "height": 32
        },
        {
          "x": 448,
          "y": 32,
          "type": "floor",
          "width": 32,
          "height": 32
        },
        {
          "x": 480,
          "y": 32,
          "type": "floor",
          "width": 32,
          "height": 32
        },
        {
          "x": 512,
          "y": 32,
          "type": "floor",
          "width": 32,
          "height": 32
        },
        {
          "x": 544,
          "y": 32,
          "type": "floor",
          "width": 32,
          "height": 32
        },
        {
          "x": 576,
          "y": 32,
          "type": "floor",
          "width": 32,
          "height": 32
        },
        {
          "x": 608,
          "y": 32,
          "type": "floor",
          "width": 32,
          "height": 32
        },
        {
          "x": 640,
          "y": 32,
          "type": "floor",
          "width": 32,
          "height": 32
        },
        {
          "x": 672,
          "y": 32,
          "type": "floor",
          "width": 32,
          "height": 32
        },
        {
          "x": 704,
          "y": 32,
          "type": "floor",
          "width": 32,
          "height": 32
        },
        {
          "x": 736,
          "y": 32,
          "type": "floor",
          "width": 32,
          "height": 32
        },
        {
          "x": 768,
          "y": 32,
          "type": "floor",
          "width": 32,
          "height": 32
        },
        {
          "x": 0,
          "y": 64,
          "type": "floor",
          "width": 32,
          "height": 32
        },
        {
          "x": 32,
          "y": 64,
          "type": "floor",
          "width": 32,
          "height": 32
        },
        {
          "x": 64,
          "y": 64,
          "type": "floor",
          "width": 32,
          "height": 32
        },
        {
          "x": 96,
          "y": 64,
          "type": "floor",
          "width": 32,
          "height": 32
        },
        {
          "x": 128,
          "y": 64,
          "type": "floor",
          "width": 32,
          "height": 32
        },
        {
          "x": 160,
          "y": 64,
          "type": "floor",
          "width": 32,
          "height": 32
        },
        {
          "x": 192,
          "y": 64,
          "type": "floor",
          "width": 32,
          "height": 32
        },
        {
          "x": 224,
          "y": 64,
          "type": "floor",
          "width": 32,
          "height": 32
        },
        {
          "x": 256,
          "y": 64,
          "type": "floor",
          "width": 32,
          "height": 32
        },
        {
          "x": 288,
          "y": 64,
          "type": "floor",
          "width": 32,
          "height": 32
        },
        {
          "x": 320,
          "y": 64,
          "type": "floor",
          "width": 32,
          "height": 32
        },
        {
          "x": 352,
          "y": 64,
          "type": "floor",
          "width": 32,
          "height": 32
        },
        {
          "x": 384,
          "y": 64,
          "type": "floor",
          "width": 32,
          "height": 32
        },
        {
          "x": 416,
          "y": 64,
          "type": "floor",
          "width": 32,
          "height": 32
        },
        {
          "x": 448,
          "y": 64,
          "type": "floor",
          "width": 32,
          "height": 32
        },
        {
          "x": 480,
          "y": 64,
          "type": "floor",
          "width": 32,
          "height": 32
        },
        {
          "x": 512,
          "y": 64,
          "type": "floor",
          "width": 32,
          "height": 32
        },
        {
          "x": 544,
          "y": 64,
          "type": "floor",
          "width": 32,
          "height": 32
        },
        {
          "x": 576,
          "y": 64,
          "type": "floor",
          "width": 32,
          "height": 32
        },
        {
          "x": 608,
          "y": 64,
          "type": "floor",
          "width": 32,
          "height": 32
        },
        {
          "x": 640,
          "y": 64,
          "type": "floor",
          "width": 32,
          "height": 32
        },
        {
          "x": 672,
          "y": 64,
          "type": "floor",
          "width": 32,
          "height": 32
        },
        {
          "x": 704,